{
  "$ref": "#/definitions/fiszki",
  "definitions": {
    "fiszki": {
      "type": "object",
      "properties": {
        "title": {
          "type": "string"
        },
        "subtitle": {
          "type": "string"
        },
        "category": {
          "type": "string"
        },
        "cards": {
          "type": "array",
          "items": {
            "type": "object",
            "properties": {
              "cat": {
                "type": "string"
              },
              "catLabel": {
                "type": "string"
              },
              "q": {
                "type": "string"
              },
              "a": {
                "type": "string"
              }
            },
            "required": [
              "cat",
              "catLabel",
              "q",
              "a"
            ],
            "additionalProperties": false
          }
        },
        "$schema": {
          "type": "string"
        }
      },
      "required": [
        "title",
        "cards"
      ],
      "additionalProperties": false
    }
  },
  "$schema": "http://json-schema.org/draft-07/schema#"
}