{
  "title": "Config",
  "subtitle": "Opis zakresu · słowa kluczowe",
  "cards": [
    {
      "cat": "pojecie",
      "catLabel": "💡 Pojęcie",
      "q": "Przykładowe pytanie?",
      "a": "<pre>Przykładowa odpowiedź. Edytuj tę fiszkę i dodaj kolejne.</pre>"
    }
  ],
  "category": "Flyer Engine"
}